{
  "id": "550e8400-e29b-41d4-a716-446655440000",
  "assessment_type": "manatee_v1",
  "protocol_version": "1.0.0",
  "name": "Belize-2026-015",
  "assessment_started_at": "2026-03-15T14:22:00.000Z",
  "location": {
    "latitude": 17.5043,
    "longitude": -88.1962,
    "accuracy_meters": 12
  },
  "collector_id": "770e8400-e29b-41d4-a716-446655440000",
  "sync_status": "local-only"
}
